{
  "artifact_ownership": [
    {
      "artifact": "Researcher(id)",
      "consumers": [
        "Planner",
        "TripleValidation"
      ],
      "owner": "Researcher"
    },
    {
      "artifact": "plan_id",
      "consumers": [
        "Planner",
        "Refactor",
        "GapAnalysis",
        "Evaluation",
        "SchemaValidation",
        "FixtureValidation",
        "GoalValidation"
      ],
      "owner": "Researcher"
    },
    {
      "artifact": "schema_id",
      "consumers": [
        "SchemaValidation"
      ],
      "owner": "Researcher"
    },
    {
      "artifact": "fixture_id",
      "consumers": [
        "FixtureValidation"
      ],
      "owner": "Researcher"
    },
    {
      "artifact": "goal_id",
      "consumers": [
        "GoalValidation"
      ],
      "owner": "Researcher"
    },
    {
      "artifact": "validation_id",
      "consumers": [
        "TripleValidation"
      ],
      "owner": "Researcher"
    },
    {
      "artifact": "audit_id",
      "consumers": [
        "Refactor"
      ],
      "owner": "Planner"
    },
    {
      "artifact": "gap_0",
      "consumers": [
        "Evaluation"
      ],
      "owner": "GapAnalysis"
    },
    {
      "artifact": "evaluation",
      "consumers": [
        "SchemaValidation",
        "FixtureValidation",
        "GoalValidation"
      ],
      "owner": "Evaluation"
    },
    {
      "artifact": "schema_validation_result",
      "consumers": [
        "TripleValidation"
      ],
      "owner": "SchemaValidation"
    },
    {
      "artifact": "fixture_validation_result",
      "consumers": [
        "TripleValidation"
      ],
      "owner": "FixtureValidation"
    },
    {
      "artifact": "goal_validation_result",
      "consumers": [
        "TripleValidation"
      ],
      "owner": "GoalValidation"
    },
    {
      "artifact": "confirmed_package",
      "consumers": [
        "CreateHash"
      ],
      "owner": "Confirmed"
    },
    {
      "artifact": "HASH",
      "consumers": [
        "Hash"
      ],
      "owner": "CreateHash"
    },
    {
      "artifact": "hash_proof",
      "consumers": [
        "Done"
      ],
      "owner": "Hash"
    }
  ],
  "edges": [
    {
      "artifact": "Prompt_id",
      "from": "Prompt",
      "to": "Researcher"
    },
    {
      "artifact": "plan_id",
      "from": "Researcher",
      "to": "Planner"
    },
    {
      "artifact": "audit_id",
      "from": "Planner",
      "to": "Refactor"
    },
    {
      "artifact": "plan_id",
      "from": "Refactor",
      "to": "GapAnalysis"
    },
    {
      "artifact": "gap_0+plan_id",
      "from": "GapAnalysis",
      "to": "Evaluation"
    },
    {
      "artifact": "plan_id",
      "from": "Evaluation",
      "to": "SchemaValidation"
    },
    {
      "artifact": "plan_id",
      "from": "Evaluation",
      "to": "FixtureValidation"
    },
    {
      "artifact": "plan_id",
      "from": "Evaluation",
      "to": "GoalValidation"
    },
    {
      "artifact": "schema_id",
      "from": "Researcher",
      "to": "SchemaValidation"
    },
    {
      "artifact": "fixture_id",
      "from": "Researcher",
      "to": "FixtureValidation"
    },
    {
      "artifact": "goal_id",
      "from": "Researcher",
      "to": "GoalValidation"
    },
    {
      "artifact": "validation_id",
      "from": "Researcher",
      "to": "TripleValidation"
    },
    {
      "artifact": "schema_validation_result",
      "from": "SchemaValidation",
      "to": "TripleValidation"
    },
    {
      "artifact": "fixture_validation_result",
      "from": "FixtureValidation",
      "to": "TripleValidation"
    },
    {
      "artifact": "goal_validation_result",
      "from": "GoalValidation",
      "to": "TripleValidation"
    },
    {
      "artifact": "triple_validation",
      "from": "TripleValidation",
      "to": "Confirmed"
    },
    {
      "artifact": "confirmed_package",
      "from": "Confirmed",
      "to": "CreateHash"
    },
    {
      "artifact": "HASH",
      "from": "CreateHash",
      "to": "Hash"
    },
    {
      "artifact": "verified_HASH",
      "from": "Hash",
      "to": "Done"
    }
  ],
  "nodes": [
    {
      "id": "Prompt",
      "kind": "source"
    },
    {
      "id": "Researcher",
      "kind": "processor"
    },
    {
      "id": "Planner",
      "kind": "processor"
    },
    {
      "id": "Refactor",
      "kind": "processor"
    },
    {
      "id": "GapAnalysis",
      "kind": "processor"
    },
    {
      "id": "Evaluation",
      "kind": "processor"
    },
    {
      "id": "SchemaValidation",
      "kind": "validator"
    },
    {
      "id": "FixtureValidation",
      "kind": "validator"
    },
    {
      "id": "GoalValidation",
      "kind": "validator"
    },
    {
      "id": "TripleValidation",
      "kind": "gate"
    },
    {
      "id": "Confirmed",
      "kind": "gate"
    },
    {
      "id": "CreateHash",
      "kind": "proof"
    },
    {
      "id": "Hash",
      "kind": "proof"
    },
    {
      "id": "Done",
      "kind": "terminal"
    }
  ],
  "parallel_groups": [
    {
      "group_id": "TripleValidation",
      "join": "TripleValidation",
      "members": [
        "SchemaValidation",
        "FixtureValidation",
        "GoalValidation"
      ]
    }
  ],
  "version": "1",
  "workflow_id": "oneshot-canonical-workflow"
}
